{
  "cigp_version": "0.1",
  "round_id": "demo-round-0001",
  "operator_id": "cigp-reference-operator",
  "game_id": "cigp-demo-slot",
  "game_version": "1.0.0",
  "bet": {
    "currency": [
      69,
      85,
      82
    ],
    "minor_units": 100
  },
  "payout": {
    "currency": [
      69,
      85,
      82
    ],
    "minor_units": 1
  },
  "server_commitment": "4f2e8d65483c641648cdb374ae9d8abd368d269e4ddffe092a8237b8162cddd6",
  "server_seed": "2222222222222222222222222222222222222222222222222222222222222222",
  "client_seed": "cigp-demo-client",
  "nonce": 0,
  "rng": {
    "algorithm": "CIGP-REFERENCE-HMAC-SHA256",
    "version": "1",
    "output": "77edaa062c169bfbc7e174a2867140171a82666bd56f27f463de420f1494edff"
  },
  "mapping": {
    "algorithm": "CIGP-DEMO-SLOT-MODULO",
    "version": "1",
    "parameters_hash": "sha256:aaaaaaaaaaaaaaaaaaaaaaaaaaaaaaaaaaaaaaaaaaaaaaaaaaaaaaaaaaaaaaaa"
  },
  "outcome": {
    "symbols": [
      "SEVEN",
      "LEMON",
      "BAR"
    ]
  },
  "paytable_hash": "sha256:aaaaaaaaaaaaaaaaaaaaaaaaaaaaaaaaaaaaaaaaaaaaaaaaaaaaaaaaaaaaaaaa",
  "game_logic_hash": "sha256:bbbbbbbbbbbbbbbbbbbbbbbbbbbbbbbbbbbbbbbbbbbbbbbbbbbbbbbbbbbbbbbb",
  "configuration_hash": "sha256:cccccccccccccccccccccccccccccccccccccccccccccccccccccccccccccccc",
  "previous_round_hash": "sha256:genesis",
  "round_hash": "sha256:4879c131ebac8036ec687452b388c796e6d249979cb9710187c7c1f245b5255e",
  "signature": "1eb0c5ef36712e0d71c33cd995a8e0424cdc863de8435e01c09163599c779725b3aa7311cd6fab2e98e2ec6d85cf4227d06244f0ac4d52123764f8423f298608",
  "timestamp": "2026-01-01T00:00:00Z"
}